{
  "$schema": "https://json-schema.org/draft/2020-12/schema",
  "$id": "https://hcm-next.internal/schemas/timeexport/timecard.schema.json",
  "title": "HR Open TimeCard export subset (hcm-next timeexport)",
  "description": "Describes the subset of the HR Open Standards TimeCard object (https://www.hropenstandards.org/standards) that internal/domains/timeexport emits: worker, period, intervals with pay code and job allocation, and allowances, pinned to an approved revision. This is authored by the timeexport package, not copied from the standard's own published schema.",
  "type": "object",
  "required": ["workerId", "period", "revision", "intervals"],
  "additionalProperties": false,
  "properties": {
    "workerId": { "type": "string" },
    "period": {
      "type": "object",
      "required": ["start", "end"],
      "additionalProperties": false,
      "properties": {
        "start": { "type": "string" },
        "end": { "type": "string" }
      }
    },
    "revision": { "type": "string" },
    "previousRevision": { "type": "string" },
    "intervals": {
      "type": "array",
      "items": {
        "type": "object",
        "required": ["date", "minutes", "payCode", "jobAllocation", "sourceRevision"],
        "additionalProperties": false,
        "properties": {
          "date": { "type": "string" },
          "minutes": { "type": "integer" },
          "payCode": { "type": "string" },
          "jobAllocation": {
            "type": "object",
            "required": ["project", "costCode", "rateCode"],
            "additionalProperties": false,
            "properties": {
              "project": { "type": "string" },
              "costCode": { "type": "string" },
              "rateCode": { "type": "string" }
            }
          },
          "sourceRevision": { "type": "string" }
        }
      }
    },
    "allowances": {
      "type": "array",
      "items": {
        "type": "object",
        "required": ["code", "amount", "currency"],
        "additionalProperties": false,
        "properties": {
          "code": { "type": "string" },
          "amount": { "type": "string" },
          "currency": { "type": "string" }
        }
      }
    }
  }
}
